{"contract_version":"1.0.0","subject_type":"editor","editor":{"contract_version":"1.0.0","editor_id":"editor-42","monday_person_id":"person-42","display_name":"Fixture Editor","mapping_version":"identity-v1","resolution":"canonical_monday_id"},"work_cycles":[],"metrics":{"speed":[],"deadline":[],"quality":[]},"ai_annotation":null,"generated_at":"2026-09-01T11:15:00Z"}
