{
  "contract_version": "1.0.0",
  "subject_type": "editor",
  "editor": {
    "contract_version": "1.0.0",
    "editor_id": "editor-42",
    "monday_person_id": "person-42",
    "display_name": "Fixture Editor",
    "mapping_version": "identity-v1",
    "resolution": "canonical_monday_id"
  },
  "work_cycles": [
    {
      "contract_version": "1.0.0",
      "cycle_id": "cycle-1",
      "editor_id": "editor-42",
      "video_type": "short-form",
      "monday_board_id": "board-1",
      "monday_item_id": "item-1",
      "start_status": "In Progress",
      "end_status": "Ready For Approval",
      "in_progress_event_id": "event-100",
      "ready_for_approval_event_id": "event-101",
      "in_progress_at": "2026-09-01T09:00:00Z",
      "ready_for_approval_at": "2026-09-01T11:00:00Z",
      "duration_seconds": 7200,
      "requested_eta": "2026-09-01T11:30:00Z",
      "revision_context": {
        "count": 3
      }
    }
  ],
  "metrics": {
    "speed": [
      {
        "contract_version": "1.0.0",
        "metric_name": "speed",
        "editor_id": "editor-42",
        "video_type": "short-form",
        "duration_seconds": 7200,
        "cohort_video_type": "short-form",
        "cohort_median_seconds": 7500,
        "evidence": {
          "source": "monday",
          "monday_board_id": "board-1",
          "monday_item_id": "item-1",
          "column_ids": [
            "status",
            "video_type"
          ],
          "event_ids": [
            "event-100",
            "event-101"
          ],
          "source_timestamps": [
            "2026-09-01T09:00:00Z",
            "2026-09-01T11:00:00Z"
          ],
          "source_values": {
            "start": "In Progress",
            "end": "Ready For Approval",
            "video_type": "short-form"
          },
          "rule_version": "speed-v1",
          "calculated_at": "2026-09-01T11:05:00Z"
        }
      }
    ],
    "deadline": [
      {
        "contract_version": "1.0.0",
        "metric_name": "deadline",
        "editor_id": "editor-42",
        "ready_for_approval_at": "2026-09-01T11:00:00Z",
        "requested_eta": "2026-09-01T11:30:00Z",
        "result": "on_time",
        "evidence": {
          "source": "monday",
          "monday_board_id": "board-1",
          "monday_item_id": "item-1",
          "column_ids": [
            "status",
            "requested_eta"
          ],
          "event_ids": [
            "event-101"
          ],
          "source_timestamps": [
            "2026-09-01T11:00:00Z"
          ],
          "source_values": {
            "ready_for_approval_at": "2026-09-01T11:00:00Z",
            "requested_eta": "2026-09-01T11:30:00Z"
          },
          "rule_version": "deadline-v1",
          "calculated_at": "2026-09-01T11:05:00Z"
        }
      }
    ],
    "quality": [
      {
        "contract_version": "1.0.0",
        "metric_name": "quality",
        "editor_id": "editor-42",
        "performance_label": "Meets Expectations",
        "label_column_id": "performance_label",
        "label_mapping_version": "quality-label-v1",
        "revision_context": {
          "count": 3
        },
        "evidence": {
          "source": "monday",
          "monday_board_id": "board-1",
          "monday_item_id": "item-1",
          "column_ids": [
            "performance_label"
          ],
          "event_ids": [
            "event-102"
          ],
          "source_timestamps": [
            "2026-09-01T11:10:00Z"
          ],
          "source_values": {
            "performance_label": "Meets Expectations"
          },
          "rule_version": "quality-v1",
          "calculated_at": "2026-09-01T11:12:00Z"
        }
      }
    ]
  },
  "ai_annotation": null,
  "generated_at": "2026-09-01T11:15:00Z"
}
