{"contract_version":"1.0.0","subject_type":"editor","editor":{"contract_version":"1.0.0","editor_id":"editor-empty","monday_person_id":"person-7","display_name":"Fixture Editor Without Metrics","mapping_version":"identity-v1","resolution":"canonical_monday_id"},"work_cycles":[],"metrics":{"speed":[],"deadline":[],"quality":[]},"ai_annotation":null,"generated_at":"2026-09-04T06:05:00Z"}
